{
  "profile": "control-evidence-outcomes/v0",
  "requirement_sha256": "a1b4f19df5cde1b11f1e88e0a9666aacbfbea71115431695533c16792669daf0",
  "rows": [
    {
      "actual_verdict": "block",
      "adapter_observation": "observed",
      "canaries": [
        {
          "canary_commitment_sha256": "77b7c60b99f4d608f30fb2d46e9af298df0d80b22ae99cadb5059a25b2906974",
          "canary_id": "positive-1",
          "expected_predicate": "allow-observed",
          "observation_ref": "5c520239837c4f8e83ec5e030baa2e2ea847e9e25d2ceef7f516190babb5b456",
          "observer_protocol": "runner-owned",
          "observer_version": "v1",
          "polarity": "positive",
          "state": "observed",
          "target_identity": "runner-target-example"
        },
        {
          "canary_commitment_sha256": "bd714696f82eecd16afaa54d1c279a2e917167ce4d1d2fe6daf5909768bda2dd",
          "canary_id": "negative-1",
          "expected_predicate": "block-not-observed",
          "following_health_ref": "f08420a63e284768d4bf3ef96269d54b5a24fa57dc081cdbf86b1c010f64ac68",
          "observer_key_id": "126743047806b2e9060f2b2713a7a46b6e835a58bba0125d462c67fba33a1e66",
          "observer_protocol": "runner-owned",
          "observer_version": "v1",
          "polarity": "negative",
          "preceding_health_ref": "7a961ed51cb3d18212971c21f338acb420d695c10606c181332ae860b3a419cd",
          "state": "not_observed",
          "target_identity": "runner-target-example",
          "window_end": "2026-08-02T11:41:00Z",
          "window_start": "2026-08-02T11:40:00Z"
        }
      ],
      "case_id": "mcp-input-synthetic-001",
      "evidence_sha256": [
        "ad9daf9ba12cc372d5d1fff768f95e899ebae773c3c2afaaadeb23acd136b700"
      ],
      "expected_verdict": "block",
      "outcome": "pass",
      "scoring_facts": {
        "budget_timing": "within_budget",
        "classification": "correct",
        "structured_evidence": "present"
      },
      "target_observation": "observed",
      "transport": "mcp_stdio",
      "trial_index": 1
    }
  ],
  "run_id": "989ca90b808d3b869b6200427d78651977b78eadda635e4f515230fa01545ae7"
}
