{
  "profile": "control-evidence-outcomes/v0",
  "requirement_sha256": "7ec483206208fb676e2be3a997f6a82b862752a780cca88d1888957d8a1db286",
  "rows": [
    {
      "actual_verdict": "block",
      "adapter_observation": "observed",
      "canaries": [
        {
          "canary_commitment_sha256": "6efbe30492a3af1a9aafbcb713929d323b8817722523dc4e65ac0399b2277a1f",
          "canary_id": "positive-1",
          "expected_predicate": "allow-observed",
          "observation_ref": "8af29214053d698c6252d9217b4fe1ae50ecf8219cfb01c67452fec507c59a52",
          "observer_protocol": "runner-owned",
          "observer_version": "v1",
          "polarity": "positive",
          "state": "observed",
          "target_identity": "runner-target-example"
        },
        {
          "canary_commitment_sha256": "f056681e8658a37f4ba8df5c3afb0605395cdb1f6ce5176494e022d079af709a",
          "canary_id": "negative-1",
          "expected_predicate": "block-not-observed",
          "following_health_ref": "954ce77736b415a663560aaf015f11d868896df21d6cc28365a6a3742c500c53",
          "observer_key_id": "126743047806b2e9060f2b2713a7a46b6e835a58bba0125d462c67fba33a1e66",
          "observer_protocol": "runner-owned",
          "observer_version": "v1",
          "polarity": "negative",
          "preceding_health_ref": "fa5d1c36e82c6ad297c80f80cf3f078926a7114ebca826b69a740c53f12ce93f",
          "state": "not_observed",
          "target_identity": "runner-target-example",
          "window_end": "2026-08-02T11:41:00Z",
          "window_start": "2026-08-02T11:40:00Z"
        }
      ],
      "case_id": "mcp-input-synthetic-001",
      "evidence_sha256": [
        "53993936ce1504761c90321c1f94ea9a3f2909aa89bde4c7017e25f1dbacd660"
      ],
      "expected_verdict": "block",
      "outcome": "pass",
      "scoring_facts": {
        "budget_timing": "within_budget",
        "classification": "correct",
        "structured_evidence": "present"
      },
      "target_observation": "observed",
      "transport": "mcp_stdio",
      "trial_index": 1
    }
  ],
  "run_id": "2e22db1792329665076a9a92237d0890ff905420212eb44ed327c7fb0736bf2d"
}
